[
  {
    "id": "08-81-00.00-0010",
    "sourceDocumentCode": "MCRP 3-40D.12",
    "sourceDocumentTitle": "Construction Estimating",
    "sourceDocumentFull": "NTRP 4-04.2.3 / TM 3-34.41 / MCRP 3-40D.12",
    "sourceEdition": "October 2021, Change 1 October 2022",
    "division": "08",
    "divisionName": "Openings",
    "figure": "Figure 5-H-1",
    "figureTitle": "Weatherstripping",
    "sourcePage": "5-H-1",
    "workElementNumber": "08 81 00.00",
    "workElementLineNumber": "0010",
    "category": "Weatherstripping",
    "activityName": "Weatherstripping, door sweep",
    "description": "Weatherstripping, door sweep",
    "unitOfMeasure": "LF",
    "manHoursPerUnit": 0.05,
    "qaStatus": "approved",
    "createdAt": "2026-06-10T00:00:00Z",
    "updatedAt": "2026-06-10T00:00:00Z"
  },
  {
    "id": "08-81-00.00-0015",
    "sourceDocumentCode": "MCRP 3-40D.12",
    "sourceDocumentTitle": "Construction Estimating",
    "sourceDocumentFull": "NTRP 4-04.2.3 / TM 3-34.41 / MCRP 3-40D.12",
    "sourceEdition": "October 2021, Change 1 October 2022",
    "division": "08",
    "divisionName": "Openings",
    "figure": "Figure 5-H-1",
    "figureTitle": "Weatherstripping",
    "sourcePage": "5-H-1",
    "workElementNumber": "08 81 00.00",
    "workElementLineNumber": "0015",
    "category": "Weatherstripping",
    "activityName": "Weatherstripping, door sweep",
    "description": "Weatherstripping, door sweep",
    "unitOfMeasure": "LF",
    "manHoursPerUnit": 0.05,
    "qaStatus": "approved",
    "createdAt": "2026-06-10T00:00:00Z",
    "updatedAt": "2026-06-10T00:00:00Z"
  },
  {
    "id": "03-11-13.65-0100",
    "sourceDocumentCode": "MCRP 3-40D.12",
    "sourceDocumentTitle": "Construction Estimating",
    "sourceDocumentFull": "NTRP 4-04.2.3 / TM 3-34.41 / MCRP 3-40D.12",
    "sourceEdition": "October 2021, Change 1 October 2022",
    "division": "03",
    "divisionName": "Concrete",
    "figure": "Figure 5-C-7",
    "figureTitle": "Forms in Place",
    "sourcePage": "5-C-7",
    "workElementNumber": "03 11 13.65",
    "workElementLineNumber": "0100",
    "category": "Beam and spandrel forms",
    "activityName": "Beam and spandrel forms, 12-inch",
    "description": "Beam and spandrel forms, 12-inch",
    "unitOfMeasure": "SF",
    "manHoursPerUnit": 0.12,
    "qaStatus": "approved",
    "createdAt": "2026-06-10T00:00:00Z",
    "updatedAt": "2026-06-10T00:00:00Z"
  },
  {
    "id": "03-11-13.65-0110",
    "sourceDocumentCode": "MCRP 3-40D.12",
    "sourceDocumentTitle": "Construction Estimating",
    "sourceDocumentFull": "NTRP 4-04.2.3 / TM 3-34.41 / MCRP 3-40D.12",
    "sourceEdition": "October 2021, Change 1 October 2022",
    "division": "03",
    "divisionName": "Concrete",
    "figure": "Figure 5-C-7",
    "figureTitle": "Forms in Place",
    "sourcePage": "5-C-7",
    "workElementNumber": "03 11 13.65",
    "workElementLineNumber": "0110",
    "category": "Beam and spandrel forms",
    "activityName": "Beam and spandrel forms, 18-inch",
    "description": "Beam and spandrel forms, 18-inch",
    "unitOfMeasure": "SF",
    "manHoursPerUnit": 0.15,
    "qaStatus": "approved",
    "createdAt": "2026-06-10T00:00:00Z",
    "updatedAt": "2026-06-10T00:00:00Z"
  },
  {
    "id": "03-11-13.65-0120",
    "sourceDocumentCode": "MCRP 3-40D.12",
    "sourceDocumentTitle": "Construction Estimating",
    "sourceDocumentFull": "NTRP 4-04.2.3 / TM 3-34.41 / MCRP 3-40D.12",
    "sourceEdition": "October 2021, Change 1 October 2022",
    "division": "03",
    "divisionName": "Concrete",
    "figure": "Figure 5-C-7",
    "figureTitle": "Forms in Place",
    "sourcePage": "5-C-7",
    "workElementNumber": "03 11 13.65",
    "workElementLineNumber": "0120",
    "category": "Beam and spandrel forms",
    "activityName": "Beam and spandrel forms, 24-inch",
    "description": "Beam and spandrel forms, 24-inch",
    "unitOfMeasure": "SF",
    "manHoursPerUnit": 0.18,
    "qaStatus": "approved",
    "createdAt": "2026-06-10T00:00:00Z",
    "updatedAt": "2026-06-10T00:00:00Z"
  },
  {
    "id": "03-11-13.65-0040",
    "sourceDocumentCode": "MCRP 3-40D.12",
    "sourceDocumentTitle": "Construction Estimating",
    "sourceDocumentFull": "NTRP 4-04.2.3 / TM 3-34.41 / MCRP 3-40D.12",
    "sourceEdition": "October 2021, Change 1 October 2022",
    "division": "03",
    "divisionName": "Concrete",
    "figure": "Figure 5-C-7",
    "figureTitle": "Forms in Place",
    "sourcePage": "5-C-7",
    "workElementNumber": "03 11 13.65",
    "workElementLineNumber": "0040",
    "category": "Place Slab on Grade",
    "activityName": "Vapor barrier, polyethylene",
    "description": "Vapor barrier, polyethylene",
    "unitOfMeasure": "SF",
    "manHoursPerUnit": 0.002,
    "qaStatus": "approved",
    "createdAt": "2026-06-10T00:00:00Z",
    "updatedAt": "2026-06-10T00:00:00Z"
  },
  {
    "id": "03-11-13.65-0060",
    "sourceDocumentCode": "MCRP 3-40D.12",
    "sourceDocumentTitle": "Construction Estimating",
    "sourceDocumentFull": "NTRP 4-04.2.3 / TM 3-34.41 / MCRP 3-40D.12",
    "sourceEdition": "October 2021, Change 1 October 2022",
    "division": "03",
    "divisionName": "Concrete",
    "figure": "Figure 5-C-7",
    "figureTitle": "Forms in Place",
    "sourcePage": "5-C-7",
    "workElementNumber": "03 11 13.65",
    "workElementLineNumber": "0060",
    "category": "Place Slab on Grade",
    "activityName": "Place concrete, slab on grade",
    "description": "Place concrete, slab on grade",
    "unitOfMeasure": "CYD",
    "manHoursPerUnit": 0.654,
    "qaStatus": "approved",
    "createdAt": "2026-06-10T00:00:00Z",
    "updatedAt": "2026-06-10T00:00:00Z"
  }
]
